character,pinyin,pinyin_plain,pinyin_initial,definition_en,example_words,lookup_category,frequency_tier,learning_band,frequency_rank,token,frequency_per_million,coverage_rate_pct,rank_3500,rank_7000,in_3500,in_7000,in_corpus,source
的,de,de,D,"of; ~'s (possessive particle); (used after an attribute when it modifies a noun); (used at the end of a declarative sentence for emphasis); (used after a noun, verb or adjective to form a nominal expression, as in 皮革的[pi2 ge2 de5] ""one made of leather"" or 跑堂兒的|跑堂儿的[pao3 tang2 r5 de5] ""a waiter (literally, one who runs back and forth in a restaurant)"" or 新的[xin1 de5] ""new one""); also pr. [di4] or [di5] in poetry and songs",中的 (zhōng de); 似的 (shì de); 准的 (zhǔn de),Question & Function,Top 100,Zero Beginner,1.0,76938354.0,40529.65052843019,4.052965052843019,2114.0,3790.0,True,True,True,"3500, 7000, corpus"
一,yī,yi,Y,"one; single; a (article); as soon as; entire; whole; all; throughout; ""one"" radical in Chinese characters (Kangxi radical 1); also pr. [yao1] for greater clarity when spelling out numbers digit by digit",一一 (yī yī); 一下 (yī xià); 一世 (yī shì),Numbers & Measures,Top 100,Zero Beginner,2.0,35278860.0,18584.22740420746,5.911387793263765,1.0,1.0,True,True,True,"3500, 7000, corpus"
了,le,le,L,"(completed action marker); (modal particle indicating change of state, situation now); (modal particle intensifying preceding clause)",不了 (bù liǎo); 临了 (lín liǎo); 为了 (wèi le),Question & Function,Top 100,Zero Beginner,3.0,34812434.0,18338.523125462772,7.745240105810042,63.0,69.0,True,True,True,"3500, 7000, corpus"
是,shì,shi,S,to be (followed by substantives only); correct; right; true; (respectful acknowledgement of a command) very well; (adverb for emphatic assertion),不是 (bú shì); 可是 (kě shì); 总是 (zǒng shì),Question & Function,Top 100,Zero Beginner,4.0,31422712.0,16552.88253262488,9.400528359072531,1450.0,2383.0,True,True,True,"3500, 7000, corpus"
不,bù,bu,B,no; not so; (bound form) not; un-,不是 (bú shì); 不好 (bù hǎo); 不用 (bù yòng),Question & Function,Top 100,Zero Beginner,5.0,29858097.0,15728.673333120305,10.973395692384562,9.0,9.0,True,True,True,"3500, 7000, corpus"
我,wǒ,wo,W,I; me; my,我们 (wǒ men); 我的 (wǒ de); 自我 (zì wǒ),People & Pronouns,Top 100,Zero Beginner,6.0,29569261.0,15576.520063243623,12.531047698708925,1163.0,1959.0,True,True,True,"3500, 7000, corpus"
在,zài,zai,Z,to exist; to be alive; (of sb or sth) to be (located) at; (used before a verb to indicate an action in progress),不在 (bù zài); 何在 (hé zài); 健在 (jiàn zài),Question & Function,Top 100,Zero Beginner,7.0,19195987.0,10112.07810162262,13.542255508871186,631.0,996.0,True,True,True,"3500, 7000, corpus"
人,rén,ren,R,"person; people; CL:個|个[ge4],位[wei4],名[ming2]",人们 (rén men); 中国人 (zhōng guó rén); 个人 (gè rén),People & Pronouns,Top 100,Zero Beginner,8.0,18435295.0,9711.360133055568,14.513391522176743,87.0,103.0,True,True,True,"3500, 7000, corpus"
有,yǒu,you,Y,to have; there is; (bound form) having; with; -ful; -ed; -al (as in 有意[you3 yi4] intentional),没有 (méi yǒu); 有用 (yǒu yòng); 有名 (yǒu míng),Question & Function,Top 100,Zero Beginner,9.0,17847013.0,9401.46444862013,15.453537967038756,1487.0,2451.0,True,True,True,"3500, 7000, corpus"
这,zhè,zhe,Z,"(pronoun) this; these; (bound form) this; the (followed by a noun); (bound form) this; these (followed by a classifier) (in this sense, commonly pr. [zhei4], esp. in Beijing)",这下 (zhè xià); 这不 (zhè bù); 这个 (zhè ge),Numbers & Measures,Top 100,Zero Beginner,10.0,17648808.0,9297.053852794446,16.3832433523182,3108.0,5882.0,True,True,True,"3500, 7000, corpus"
他,tā,ta,T,"(third-person singular) (since the early 20th century, usu. male) he; him; his; (bound form) other; another; some other (as in 他日[ta1 ri4] and 他人[ta1 ren2])",他们 (tā men); 他的 (tā de); 他人 (tā rén),People & Pronouns,Top 100,Zero Beginner,11.0,17596473.0,9269.48477768263,17.310191830086463,101.0,122.0,True,True,True,"3500, 7000, corpus"
来,lái,lai,L,"to come; (used as a substitute for a more specific verb); hither (directional complement for motion toward the speaker, as in 回來|回来[hui2 lai5]); ever since (as in 自古以來|自古以来[zi4 gu3 yi3 lai2]); for the past (amount of time); (prefix) the coming ...; the next ... (as in 來世|来世[lai2 shi4]); (between two verbs) in order to; (after a round number) approximately; (used after 得[de2] to indicate possibility, as in 談得來|谈得来[tan2 de5 lai2], or after 不[bu4] to indicate impossibility, as in 吃不來|吃不来[chi1 bu5 lai2])",回来 (huí lái); 进来 (jìn lái); 来到 (lái dào),Places & Movement,Top 100,Zero Beginner,12.0,14837007.0,7815.8509681383675,18.0917769269003,1520.0,2493.0,True,True,True,"3500, 7000, corpus"
个,gè,ge,G,used in 自個兒|自个儿[zi4 ge3 r5],一个 (yí gè); 上个 (shàng gè); 下个 (xià gè),Numbers & Measures,Top 100,Zero Beginner,13.0,14789406.0,7790.775673509581,18.870854494251258,26.0,28.0,True,True,True,"3500, 7000, corpus"
你,nǐ,ni,N,"you (informal, as opposed to courteous 您[nin2])",你好 (nǐ hǎo); 你们 (nǐ men); 你的 (nǐ de),People & Pronouns,Top 100,Zero Beginner,14.0,14221925.0,7491.83755726753,19.620038249978013,151.0,196.0,True,True,True,"3500, 7000, corpus"
说,shuō,shuo,S,to persuade,说话 (shuō huà); 说明 (shuō míng); 小说 (xiǎo shuō),Actions,Top 100,Zero Beginner,15.0,12000460.0,6321.612364886378,20.25219948646665,2920.0,5524.0,True,True,True,"3500, 7000, corpus"
上,shàng,shang,S,used in 上聲|上声[shang3 sheng1],上万 (shàng wàn); 上下 (shàng xià); 上个 (shàng gè),Places & Movement,Top 100,Zero Beginner,16.0,11918291.0,6278.3273102792755,20.880032217494577,7.0,7.0,True,True,True,"3500, 7000, corpus"
到,dào,dao,D,to reach; to arrive; to leave for; to go to; to (a place); until (a time); up to (a point); (verb complement indicating arriving at a place or reaching a point); considerate; thoughtful; thorough,不到 (bú dào); 临到 (lín dào); 做到 (zuò dào),Places & Movement,Top 100,Zero Beginner,17.0,11505436.0,6060.843207761109,21.48611653827069,319.0,455.0,True,True,True,"3500, 7000, corpus"
就,jiù,jiu,J,(after a suppositional clause) in that case; then; (after a clause of action) as soon as; immediately after; (same as 就是[jiu4 shi4]) merely; nothing else but; simply; just; precisely; exactly; only; as little as; as much as; as many as; to approach; to move towards; to undertake; to engage in; (often followed by 著|着[zhe5]) taking advantage of; (of food) to go with; with regard to; concerning; (bound form) to reach; to attain (as in 一蹴而就[yi1 cu4 er2 jiu4]); (pattern: 就[jiu4] ... 也[ye3] ...) even if ... still ...; (pattern: 不[bu4] ... 就[jiu4] ...) if not ... then must be ...,俯就 (fǔ jiù); 可就 (kě jiù); 将就 (jiāng jiù),Question & Function,Top 100,Zero Beginner,18.0,11305679.0,5955.615048076179,22.081678043078306,876.0,1435.0,True,True,True,"3500, 7000, corpus"
着,zhe,zhe,Z,a move in chess (Taiwan pr. [zhuo2]); trick; tactic; (dialect) okay; all right; (dialect) to put in; to add,不着 (bù zhe); 为着 (wèi zhe); 依着 (yī zhe),Actions,Top 100,Zero Beginner,19.0,11165468.0,5881.754580119694,22.669853501090273,2152.0,3859.0,True,True,True,"3500, 7000, corpus"
大,dà,da,D,big; large; great; older (than another person); eldest (as in 大姐[da4 jie3]); greatly; freely; fully; (dialect) father; (dialect) uncle (father's brother),不大 (bù dà); 东大 (dōng dà); 伟大 (wěi dà),People & Pronouns,Top 100,Zero Beginner,20.0,10828984.0,5704.50125691488,23.24030362678176,712.0,1162.0,True,True,True,"3500, 7000, corpus"
们,men,men,M,"plural marker for pronouns, and nouns referring to individuals",亚们 (yà men); 亲们 (qīn men); 人们 (rén men),People & Pronouns,Top 100,Zero Beginner,21.0,10741873.0,5658.612851410624,23.80616491192282,109.0,135.0,True,True,True,"3500, 7000, corpus"
道,dào,dao,D,"road; path (CL:條|条[tiao2],股[gu3]); (bound form) way; reason; principle; (bound form) a skill; an art; a specialization; (Daoism) the Way; the Dao; to say (introducing a direct quotation, as in a novel); (bound form) to express; to extend (polite words); classifier for long thin things (rivers, cracks, shadows etc), barriers (walls, doors etc), questions (in an exam etc), commands, courses in a meal, steps in a process; (old) circuit (administrative division)",一道 (yī dào); 世道 (shì dào); 东道 (dōng dào),People & Pronouns,Top 100,Zero Beginner,22.0,10625536.0,5597.32874916006,24.365897786838826,3147.0,5948.0,True,True,True,"3500, 7000, corpus"
那,nà,na,N,surname Na,刹那 (chà nà); 支那 (zhī nà); 沙那 (shā nà),General Reference,Top 100,Zero Beginner,23.0,9929703.0,5230.777258909189,24.888975512729743,3159.0,5976.0,True,True,True,"3500, 7000, corpus"
么,me,me,M,exclamatory final particle,么么 (me me); 什么 (shén me); 多么 (duō me),Question & Function,Top 100,Zero Beginner,24.0,9727134.0,5124.067791510217,25.401382291880765,39.0,43.0,True,True,True,"3500, 7000, corpus"
也,yě,ye,Y,surname Ye,也好 (yě hǎo); 也罢 (yě bà); 也许 (yě xǔ),Question & Function,Top 100,Zero Beginner,25.0,9508702.0,5009.001999691664,25.90228249184993,55.0,60.0,True,True,True,"3500, 7000, corpus"
地,dì,di,D,"-ly; structural particle: used before a verb or adjective, linking it to preceding modifying adverbial adjunct",下地 (xià dì); 产地 (chǎn dì); 伏地 (fú dì),Question & Function,Top 100,Zero Beginner,26.0,8804040.0,4637.799561429667,26.3660624479929,632.0,1003.0,True,True,True,"3500, 7000, corpus"
子,zi,zi,Z,"son; child; seed; egg; small thing; 1st earthly branch: 11 p.m.–1 a.m., midnight, 11th solar month (7th December to 5th January), year of the rat; viscount, fourth of five orders of nobility 五等爵位[wu3 deng3 jue2 wei4]; ancient Chinese compass point: 0° (north); subsidiary; subordinate; (prefix) sub-",世子 (shì zi); 丙子 (bǐng zi); 个子 (gè zi),People & Pronouns,Top 100,Zero Beginner,27.0,8641973.0,4552.425771496612,26.82130502514256,796.0,1326.0,True,True,True,"3500, 7000, corpus"
下,xià,xia,X,"down; downwards; below; lower; later; next (week etc); second (of two parts); to decline; to go down; to arrive at (a decision, conclusion etc); measure word to show the frequency of an action",一下 (yī xià); 上下 (shàng xià); 下世 (xià shì),Places & Movement,Top 100,Zero Beginner,28.0,8550882.0,4504.44077826053,27.271749102968613,8.0,8.0,True,True,True,"3500, 7000, corpus"
出,chū,chu,C,"to go out; to come out; to arise; to occur; to produce; to yield; to go beyond; to exceed; (used after a verb to indicate an outward direction or a positive result); classifier for dramas, plays, operas etc",交出 (jiāo chū); 产出 (chǎn chū); 亮出 (liàng chū),Places & Movement,Top 100,Zero Beginner,29.0,8294943.0,4369.617017583301,27.708710804726945,295.0,425.0,True,True,True,"3500, 7000, corpus"
时,shí,shi,S,surname Shi,时间 (shí jiān); 小时 (xiǎo shí); 同时 (tóng shí),Time,Top 100,Zero Beginner,30.0,8207119.0,4323.353017342162,28.14104610646116,1433.0,2358.0,True,True,True,"3500, 7000, corpus"
看,kàn,kan,K,to look after; to take care of; to watch; to guard,中看 (zhōng kàn); 乍看 (zhà kàn); 俯看 (fǔ kàn),Actions,Top 100,Zero Beginner,31.0,8030267.0,4230.190772731965,28.564065183734357,2144.0,3840.0,True,True,True,"3500, 7000, corpus"
要,yào,yao,Y,(bound form) to demand; to coerce,不要 (bú yào); 主要 (zhǔ yào); 会要 (huì yào),Actions,Top 100,Zero Beginner,32.0,7944606.0,4185.066199441564,28.982571803678514,2857.0,5404.0,True,True,True,"3500, 7000, corpus"
她,tā,ta,T,she,她们 (tā men); 她的 (tā de); 她玛 (tā mǎ),People & Pronouns,Top 100,Zero Beginner,33.0,7870163.0,4145.851053582219,29.397156909036735,743.0,1201.0,True,True,True,"3500, 7000, corpus"
中,zhōng,zhong,Z,(bound form) China; Chinese; surname Zhong,中国 (zhōng guó); 中文 (zhōng wén); 中间 (zhōng jiān),Places & Movement,Top 100,Zero Beginner,34.0,7680869.0,4046.1346017963037,29.801770369216364,27.0,30.0,True,True,True,"3500, 7000, corpus"
没,méi,mei,M,(negative prefix for verbs) have not; not,从没 (cóng méi); 出没 (chū mò); 吞没 (tūn mò),Question & Function,Top 100,Zero Beginner,35.0,7560391.0,3982.669100099137,30.200037279226276,1727.0,2916.0,True,True,True,"3500, 7000, corpus"
然,rán,ran,R,correct; right; so; thus; like this; -ly,不然 (bù rán); 了然 (liǎo rán); 井然 (jǐng rán),General Reference,Top 100,Zero Beginner,36.0,7339938.0,3866.5386842087214,30.586691147647148,1932.0,3343.0,True,True,True,"3500, 7000, corpus"
里,lǐ,li,L,lining; interior; inside; internal; also written 裏|里[li3],万里 (wàn lǐ); 公里 (gōng lǐ); 内里 (nèi lǐ),Places & Movement,Top 100,Zero Beginner,37.0,7329328.0,3860.949539526647,30.972786101599812,3192.0,6096.0,True,True,True,"3500, 7000, corpus"
为,wèi,wei,W,as (in the capacity of); to take sth as; to act as; to serve as; to behave as; to become; to be; to do; by (in the passive voice),为上 (wèi shàng); 为主 (wéi zhǔ); 为了 (wèi le),Question & Function,Top 100,Zero Beginner,38.0,7309300.0,3850.3991729203717,31.35782601889185,33.0,36.0,True,True,True,"3500, 7000, corpus"
过,guò,guo,G,surname Guo,不过 (bù guò); 借过 (jiè guò); 划过 (huá guò),General Reference,Top 100,Zero Beginner,39.0,7307184.0,3849.28450466898,31.742754469358747,3101.0,5873.0,True,True,True,"3500, 7000, corpus"
自,zì,zi,Z,(bound form) self; oneself; from; since; naturally; as a matter of course,亲自 (qīn zì); 兀自 (wù zì); 出自 (chū zì),Numbers & Measures,Top 100,Zero Beginner,40.0,7261699.0,3825.323878291586,32.12528685718791,2592.0,4750.0,True,True,True,"3500, 7000, corpus"
好,hǎo,hao,H,good; appropriate; proper; all right!; (before a verb) easy to; (before a verb) good to; (before an adjective for exclamatory effect) so; (verb complement indicating completion); (of two people) close; on intimate terms; (after a personal pronoun) hello,上好 (shàng hǎo); 不好 (bù hǎo); 也好 (yě hǎo),People & Pronouns,Top 100,Zero Beginner,41.0,7259684.0,3824.262414904745,32.50771309867839,744.0,1202.0,True,True,True,"3500, 7000, corpus"
得,dé,de,D,to obtain; to get; to gain; to catch (a disease); proper; suitable; proud; contented; to allow; to permit; ready; finished,不得 (bù dé); 乍得 (zhà dé); 习得 (xí dé),Actions,Top 100,Zero Beginner,42.0,7186260.0,3785.584058718448,32.88627150455023,1043.0,1735.0,True,True,True,"3500, 7000, corpus"
去,qù,qu,Q,to go; to go to (a place); (of a time etc) last; just passed; to send; to remove; to get rid of; to reduce; to be apart from in space or time; to die (euphemism); to play (a part); (when used either before or after a verb) to go in order to do sth; (after a verb of motion indicates movement away from the speaker); (used after certain verbs to indicate detachment or separation),出去 (chū qù); 回去 (huí qù); 去年 (qù nián),Places & Movement,Top 100,Zero Beginner,43.0,7182400.0,3783.550684687081,33.26462657301894,427.0,612.0,True,True,True,"3500, 7000, corpus"
可,kě,ke,K,(prefix) can; may; able to; -able; to approve; to permit; to suit; (particle used for emphasis) certainly; very; but; however,不可 (bù kě); 即可 (jí kě); 可亲 (kě qīn),Question & Function,Top 100,Zero Beginner,44.0,7069176.0,3723.9064511825404,33.63701721813719,455.0,643.0,True,True,True,"3500, 7000, corpus"
会,huì,hui,H,can; to have the skill; to know how to; to be likely to; to be sure to; to meet; to get together; meeting; gathering; (suffix) union; group; association; (bound form) a moment (Taiwan pr. [hui3]),会议 (huì yì); 开会 (kāi huì); 会说 (huì shuō),Business & Work,Top 100,Zero Beginner,45.0,6824927.0,3595.240758491499,33.99654129398634,126.0,157.0,True,True,True,"3500, 7000, corpus"
天,tiān,tian,T,day; sky; heaven,今天 (jīn tiān); 明天 (míng tiān); 天气 (tiān qì),Time,Top 100,Zero Beginner,46.0,6797499.0,3580.7922136903744,34.35462051535538,713.0,1163.0,True,True,True,"3500, 7000, corpus"
还,hái,hai,H,surname Huan,交还 (jiāo huán); 偿还 (cháng huán); 回还 (huí huán),General Reference,Top 100,Zero Beginner,47.0,6776145.0,3569.543335694049,34.71157484892478,3107.0,5881.0,True,True,True,"3500, 7000, corpus"
心,xīn,xin,X,"heart; mind; intention; center; core; CL:顆|颗[ke1],個|个[ge4]",一心 (yī xīn); 上心 (shàng xīn); 专心 (zhuān xīn),Actions,Top 100,Zero Beginner,48.0,6555833.0,3453.48719590167,35.056923568514954,1051.0,1748.0,True,True,True,"3500, 7000, corpus"
后,hòu,hou,H,surname Hou,之后 (zhī hòu); 事后 (shì hòu); 产后 (chǎn hòu),Time,Top 100,Zero Beginner,49.0,6544446.0,3447.488742509137,35.401672442765864,474.0,665.0,True,True,True,"3500, 7000, corpus"
以,yǐ,yi,Y,abbr. for Israel 以色列[Yi3 se4 lie4],乘以 (chéng yǐ); 予以 (yǔ yǐ); 以上 (yǐ shàng),General Reference,Top 100,Zero Beginner,50.0,6523162.0,3436.2767391714115,35.745300116683005,107.0,131.0,True,True,True,"3500, 7000, corpus"
小,xiǎo,xiao,X,small; tiny; few; young,三小 (sān xiǎo); 从小 (cóng xiǎo); 做小 (zuò xiǎo),General Reference,Top 100,Zero Beginner,51.0,6383822.0,3362.8750973240767,36.08158762641541,868.0,1422.0,True,True,True,"3500, 7000, corpus"
都,dōu,dou,D,surname Du,上都 (shàng dōu); 中都 (zhōng dū); 京都 (jīng dū),Question & Function,Top 100,Zero Beginner,52.0,6342930.0,3341.3339753316754,36.41572102394858,3170.0,6021.0,True,True,True,"3500, 7000, corpus"
和,hé,he,H,surname He,不和 (bù hé); 中和 (zhōng hé); 乞和 (qǐ hé),Question & Function,Top 100,Zero Beginner,53.0,6252031.0,3293.450124016325,36.74506603635021,519.0,732.0,True,True,True,"3500, 7000, corpus"
对,duì,dui,D,right; correct; towards; at; for; concerning; regarding; to treat (sb a certain way); to face; (bound form) opposite; facing; matching; to match together; to adjust; to fit; to suit; to answer; to reply; to add; to pour in (a fluid); to check; to compare; classifier: couple; pair,一对 (yī duì); 不对 (bú duì); 作对 (zuò duì),Actions,Top 100,Zero Beginner,54.0,6195038.0,3263.427303765104,37.07140876672672,858.0,1412.0,True,True,True,"3500, 7000, corpus"
想,xiǎng,xiang,X,to think (about); to think of; to devise; to think (that); to believe (that); to desire; to want (to); to miss (feel wistful about the absence of),不想 (bù xiǎng); 休想 (xiū xiǎng); 假想 (jiǎ xiǎng),Actions,Top 100,Zero Beginner,55.0,6140550.0,3234.724069510923,37.39488117367781,1128.0,1893.0,True,True,True,"3500, 7000, corpus"
能,néng,neng,N,surname Neng,万能 (wàn néng); 不能 (bù néng); 低能 (dī néng),Actions,Top 100,Zero Beginner,56.0,5933639.0,3125.727319717081,37.707453905649515,2550.0,4669.0,True,True,True,"3500, 7000, corpus"
起,qǐ,qi,Q,"to rise; to raise; to get up; to set out; to start; to appear; to launch; to initiate (action); to draft; to establish; to get (from a depot or counter); verb suffix, to start; starting from (a time, place, price etc); classifier for occurrences or unpredictable events: case, instance; classifier for groups: batch, group",一起 (yì qǐ); 举起 (jǔ qǐ); 兴起 (xīng qǐ),Business & Work,Top 100,Zero Beginner,57.0,5819918.0,3065.8212761364816,38.01403603326316,3016.0,5688.0,True,True,True,"3500, 7000, corpus"
之,zhī,zhi,Z,"(possessive particle, literary equivalent of 的[de5]); him; her; it",久之 (jiǔ zhī); 之一 (zhī yī); 之上 (zhī shàng),Question & Function,Top 100,Zero Beginner,58.0,5373763.0,2830.795371741493,38.297115570437306,41.0,45.0,True,True,True,"3500, 7000, corpus"
手,shǒu,shou,S,"hand; (formal) to hold; person engaged in certain types of work; person skilled in certain types of work; personal(ly); convenient; classifier for skill; CL:雙|双[shuang1],隻|只[zhi1]",一手 (yī shǒu); 上手 (shàng shǒu); 下手 (xià shǒu),Business & Work,Top 100,Zero Beginner,59.0,5076179.0,2674.0338231014953,38.564518952747456,1176.0,1988.0,True,True,True,"3500, 7000, corpus"
而,ér,er,E,and; as well as; and so; but (not); yet (not); (indicates causal relation); (indicates change of state); (indicates contrast),从而 (cóng ér); 俄而 (é ér); 假而 (jiǎ ér),Question & Function,Top 100,Zero Beginner,60.0,5075337.0,2673.590273636622,38.831877980111116,2488.0,4553.0,True,True,True,"3500, 7000, corpus"
只,zhǐ,zhi,Z,only; merely; just,不只 (bù zhǐ); 只好 (zhǐ hǎo); 只当 (zhǐ dāng),Numbers & Measures,Top 100,Zero Beginner,61.0,5050153.0,2660.3238250340432,39.09791036261452,450.0,638.0,True,True,True,"3500, 7000, corpus"
生,shēng,sheng,S,to grow; to give birth; to produce; to be born; to arise; to occur; to light (a fire); to live; to be alive; life; raw; uncooked; unprocessed; unfamiliar; strange; (bound form) student; person engaged in a field; (bound form) male role in traditional opera; (bound form) life; lifetime; (bound form) means of livelihood; (bound form) very; intensely (as in 生疼[sheng1 teng2]); (bound form) in a forced manner (as in 生拉硬拽[sheng1 la1 ying4 zhuai4]),一生 (yī shēng); 丛生 (cóng shēng); 丧生 (sàng shēng),People & Pronouns,Top 100,Zero Beginner,62.0,4966773.0,2616.400838833162,39.359550446497835,2048.0,3643.0,True,True,True,"3500, 7000, corpus"
什,shén,shen,S,what,什么 (shén me); 什叶 (shén yè); 什器 (shén qì),General Reference,Top 100,Zero Beginner,63.0,4828364.0,2543.4896299452066,39.613899409492355,89.0,105.0,True,True,True,"3500, 7000, corpus"
身,shēn,shen,S,"body; life; oneself; personally; one's morality and conduct; the main part of a structure or body; pregnant; classifier for sets of clothes: suit, twinset; Kangxi radical 158",一身 (yī shēn); 上身 (shàng shēn); 下身 (xià shēn),People & Pronouns,Top 100,Zero Beginner,64.0,4819905.0,2539.033590843824,39.86780276857674,3056.0,5798.0,True,True,True,"3500, 7000, corpus"
头,tóu,tou,T,head; hair style; the top; end; beginning or end; a stub; remnant; chief; boss; side; aspect; first; leading; classifier for pigs or livestock; CL:個|个[ge4],一头 (yī tóu); 上头 (shàng tou); 下头 (xià tou),Numbers & Measures,Top 100,Zero Beginner,65.0,4813712.0,2535.771237119405,40.12137989228868,720.0,1171.0,True,True,True,"3500, 7000, corpus"
样,yàng,yang,Y,"manner; pattern; way; appearance; shape; classifier: kind, type",一样 (yī yàng); 两样 (liǎng yàng); 像样 (xiàng yàng),Numbers & Measures,Top 100,Zero Beginner,66.0,4769842.0,2512.6613617939956,40.37264602846808,1569.0,2586.0,True,True,True,"3500, 7000, corpus"
事,shì,shi,S,"matter; thing; item; work; affair; CL:件[jian4],樁|桩[zhuang1],回[hui2]",七事 (qī shì); 万事 (wàn shì); 丑事 (chǒu shì),Business & Work,Top 100,Zero Beginner,67.0,4729336.0,2491.3235772047306,40.62177838618855,66.0,72.0,True,True,True,"3500, 7000, corpus"
多,duō,duo,D,many; much; more; a lot of; too many; in excess; (after a numeral) ... odd; how (to what extent) (Taiwan pr. [duo2]); (bound form) multi-; poly-,众多 (zhòng duō); 几多 (jǐ duō); 基多 (jī duō),Actions,Top 100,Zero Beginner,68.0,4617194.0,2432.249320565978,40.86500331824515,709.0,1157.0,True,True,True,"3500, 7000, corpus"
己,jǐ,ji,J,"self; oneself; sixth of the ten Heavenly Stems 十天干[shi2 tian1 gan1]; sixth in order; letter ""F"" or Roman ""VI"" in list ""A, B, C"", or ""I, II, III"" etc; hexa",一己 (yī jǐ); 体己 (tī jǐ); 克己 (kè jǐ),Numbers & Measures,Top 100,Zero Beginner,69.0,4569251.0,2406.99386689089,41.10570270493424,937.0,1566.0,True,True,True,"3500, 7000, corpus"
家,jiā,jia,J,used in 傢伙|家伙[jia1 huo5] and 傢俱|家俱[jia1 ju4],一家 (yī jiā); 上家 (shàng jiā); 下家 (xià jiā),Places & Movement,Top 100,Zero Beginner,70.0,4546765.0,2395.14867298692,41.34521757223293,839.0,1387.0,True,True,True,"3500, 7000, corpus"
面,miàn,mian,M,"face; side; surface; aspect; top; classifier for objects with flat surfaces such as drums, mirrors, flags etc",一面 (yí miàn); 上面 (shàng miàn); 下面 (xià miàn),Numbers & Measures,Top 100,Zero Beginner,71.0,4532962.0,2387.877517091852,41.584005323942115,3354.0,6500.0,True,True,True,"3500, 7000, corpus"
知,zhī,zhi,Z,to know; to be aware,不知 (bù zhī); 了知 (le zhī); 先知 (xiān zhī),Actions,Top 100,Zero Beginner,72.0,4397165.0,2316.3422597505105,41.815639549917165,2172.0,3908.0,True,True,True,"3500, 7000, corpus"
开,kāi,kai,K,"to open (transitive or intransitive); (of ships, vehicles, troops etc) to start; to turn on; to put in operation; to operate; to run; to boil; to write out (a prescription, check, invoice etc); (directional complement) away; off; carat (gold); abbr. for Kelvin, 開爾文|开尔文[Kai1 er3 wen2]; abbr. for 開本|开本[kai1 ben3], book format",丢开 (diū kāi); 传开 (chuán kāi); 伸开 (shēn kāi),Actions,Top 100,Zero Beginner,73.0,4346834.0,2289.828853436328,42.0446224352608,1002.0,1671.0,True,True,True,"3500, 7000, corpus"
如,rú,ru,R,as; as if; such as,一如 (yī rú); 不如 (bù rú); 仿如 (fǎng rú),General Reference,Top 100,Zero Beginner,74.0,4308194.0,2269.4740418891697,42.27156983944972,745.0,1204.0,True,True,True,"3500, 7000, corpus"
无,wú,wu,W,used in 南無|南无[na1 mo2],三无 (sān wú); 不无 (bù wú); 了无 (liǎo wú),General Reference,Top 100,Zero Beginner,75.0,4177289.0,2200.515796403126,42.49162141909003,1423.0,2345.0,True,True,True,"3500, 7000, corpus"
现,xiàn,xian,X,to appear; present; now; existing; current,乍现 (zhà xiàn); 付现 (fù xiàn); 体现 (tǐ xiàn),Time,Top 100,Zero Beginner,76.0,4161139.0,2192.0082858832857,42.71082224767836,2015.0,3532.0,True,True,True,"3500, 7000, corpus"
